[
  {
    "trend_id": "arxiv_2607.02514",
    "source": "arxiv",
    "title": "Distributed Attacks in Persistent-State AI Control",
    "summary": "As AI coding agents become more autonomous, they increasingly ship code iteratively, with the codebase persisting across sessions. This persistence creates a new attack surface: a misaligned or prompt-injected agent can distribute attacks across pull requests (PRs) and time its payload for the PR with the best natural cover. To study the resulting dynamics, we introduce Iterative VibeCoding, a setting for AI control, the study of safely deploying capable but potentially untrusted AI. In Iterative VibeCoding, a coding agent builds software over a sequence of PRs in a persistent codebase while pursuing a covert side task. Our benchmark includes two task families: CLI tools and Flask web services, across 20 total task variations. We use Claude Sonnet 4.5 as the attack agent and GPT-4o as the monitor. We compare gradual attacks, which distribute the side task across PRs, against non-gradual attacks concentrated in a single PR. No single monitor is robust to both: which strategy evades best (success while evading the monitor) depends on the monitor type, so a defender cannot close off both gradual and non-gradual attacks with any one monitor. High evasion (>= 65%) generalizes across model attack agent backends (Sonnet 4.5, Gemini 3.1 Pro, Kimi K2.5), confirming this is a property of the persistent-state attack surface rather than a single model's capability. Evasion also remains high across state-of-the-art monitor models and the gap between gradual and non-gradual evasion widens for more capable models. We introduce a stateful link-tracker monitor that tracks suspicious buildup across PRs. On both task families, it detects gradual attacks substantially better than diff monitors that merely see more accumulated history. Combining this stronger monitor with trajectory monitors in a four-monitor ensemble reduces gradual-attack evasion from 93% under the weakest standard diff monitor to 47%.",
    "url": "http://arxiv.org/abs/2607.02514v1",
    "published_at": "2026-07-02T17:59:56Z",
    "authors_or_org": [
      "Josh Hills",
      "Ida Caspary",
      "Asa Cooper Stickland"
    ],
    "type": "paper",
    "task_tags": [
      "Agent",
      "Evaluation"
    ],
    "dependency_tags": [],
    "impact_tags": [
      "accuracy",
      "scalability"
    ],
    "keyword_tags": [
      "agent",
      "benchmark"
    ],
    "raw_text": "As AI coding agents become more autonomous, they increasingly ship code iteratively, with the codebase persisting across sessions. This persistence creates a new attack surface: a misaligned or prompt-injected agent can distribute attacks across pull requests (PRs) and time its payload for the PR with the best natural cover. To study the resulting dynamics, we introduce Iterative VibeCoding, a setting for AI control, the study of safely deploying capable but potentially untrusted AI. In Iterative VibeCoding, a coding agent builds software over a sequence of PRs in a persistent codebase while pursuing a covert side task. Our benchmark includes two task families: CLI tools and Flask web services, across 20 total task variations. We use Claude Sonnet 4.5 as the attack agent and GPT-4o as the monitor. We compare gradual attacks, which distribute the side task across PRs, against non-gradual attacks concentrated in a single PR. No single monitor is robust to both: which strategy evades best (success while evading the monitor) depends on the monitor type, so a defender cannot close off both gradual and non-gradual attacks with any one monitor. High evasion (>= 65%) generalizes across model attack agent backends (Sonnet 4.5, Gemini 3.1 Pro, Kimi K2.5), confirming this is a property of the persistent-state attack surface rather than a single model's capability. Evasion also remains high across state-of-the-art monitor models and the gap between gradual and non-gradual evasion widens for more capable models. We introduce a stateful link-tracker monitor that tracks suspicious buildup across PRs. On both task families, it detects gradual attacks substantially better than diff monitors that merely see more accumulated history. Combining this stronger monitor with trajectory monitors in a four-monitor ensemble reduces gradual-attack evasion from 93% under the weakest standard diff monitor to 47%.",
    "embedding_text": "Distributed Attacks in Persistent-State AI Control. As AI coding agents become more autonomous, they increasingly ship code iteratively, with the codebase persisting across sessions. This persistence creates a new attack surface: a misaligned or prompt-injected agent can distribute attacks across pull requests (PRs) and time its payload for the PR with the best natural cover. To study the resulting dynamics, we introduce Iterative VibeCoding, a setting for AI control, the study of safely deploying capable but potentially untrusted AI. In Iterative VibeCoding, a coding agent builds software over a sequence of PRs in a persistent codebase while pursuing a covert side task. Our benchmark includes two task families: CLI tools and Flask web services, across 20 total task variations. We use Claude Sonnet 4.5 as the attack agent and GPT-4o as the monitor. We compare gradual attacks, which distribute the side task across PRs, against non-gradual attacks concentrated in a single PR. No single monitor is robust to both: which strategy evades best (success while evading the monitor) depends on the monitor type, so a defender cannot close off both gradual and non-gradual attacks with any one monitor. High evasion (>= 65%) generalizes across model attack agent backends (Sonnet 4.5, Gemini 3.1 Pro, Kimi K2.5), confirming this is a property of the persistent-state attack surface rather than a single model's capability. Evasion also remains high across state-of-the-art monitor models and the gap between gradual and non-gradual evasion widens for more capable models. We introduce a stateful link-tracker monitor that tracks suspicious buildup across PRs. On both task families, it detects gradual attacks substantially better than diff monitors that merely see more accumulated history. Combining this stronger monitor with trajectory monitors in a four-monitor ensemble reduces gradual-attack evasion from 93% under the weakest standard diff monitor to 47%.. Tags: Agent, Evaluation, accuracy, scalability, agent, benchmark.",
    "metadata": {
      "source_score": null,
      "stars": null,
      "forks": null,
      "comments": null,
      "language": null,
      "categories": [
        "cs.AI"
      ]
    }
  },
  {
    "trend_id": "arxiv_2607.02513",
    "source": "arxiv",
    "title": "LACUNA: A Testbed for Evaluating Localization Precision for LLM Unlearning",
    "summary": "LLMs memorize sensitive training data, including personally identifiable information (PII), creating a pressing need for reliable post hoc removal methods. Unlearning has emerged as a promising solution, with state-of-the-art(SOTA) methods often following a localize-first, unlearn-second paradigm that targets specific model parameters. However, existing benchmarks evaluate unlearning solely at the output level, leaving open the question of whether unlearning truly erases knowledge from a model's parameters or merely obfuscates it, a concern reinforced by the success of resurfacing attacks. To bridge this gap, we introduce LACUNA: the first unlearning testbed with ground-truth parameter-level localization. LACUNA injects PII of synthetic individuals into predefined parameters of 1B and 7B OLMo-based models via masked continual pretraining, enabling direct evaluation of whether unlearning targets the weights responsible for knowledge storage. We use LACUNA to benchmark current SOTA unlearning methods and find that, despite strong output-level performance, existing methods are highly imprecise and susceptible to resurfacing attacks. We further show that when localization is successful, even a simple gradient-based unlearning method achieves strong erasure and robustness to resurfacing attacks, highlighting the importance of precise unlearning. We release LACUNA to complement behavioral evaluations and drive further advances in robust, localization-based unlearning.",
    "url": "http://arxiv.org/abs/2607.02513v1",
    "published_at": "2026-07-02T17:59:52Z",
    "authors_or_org": [
      "Matteo Boglioni",
      "Thibault Rousset",
      "Siva Reddy",
      "Marius Mosbach",
      "Verna Dankers"
    ],
    "type": "paper",
    "task_tags": [
      "Evaluation"
    ],
    "dependency_tags": [],
    "impact_tags": [
      "accuracy"
    ],
    "keyword_tags": [
      "benchmark",
      "evaluation"
    ],